ticker,name,asset_class,assets_aum
VTG,Vanguard Total Treasury ETF,Fixed Income,85.33M
CVMC,Calvert US Mid-Cap Core Responsible Index ETF,Equity,85.20M
FCLD,Fidelity Cloud Computing ETF,Equity,85.11M
RISN,Inspire Capital Appreciation ETF,Asset Allocation,84.94M
TRUT,VanEck Technology TruSector ETF,Equity,84.90M
ECNS,iShares MSCI China Small-Cap ETF,Equity,84.81M
IQM,Franklin Intelligent Machines ETF,Equity,84.59M
BSJV,Invesco BulletShares 2031 High Yield Corporate Bond ETF,Fixed Income,84.58M
ITEQ,Amplify BlueStar Israel Technology ETF,Equity,84.49M
TCV,Towle Value ETF,Equity,84.46M
DRNZ,REX Drone ETF,Equity,84.43M
FPFD,Fidelity Preferred Securities & Income ETF,Fixed Income,83.90M
MMLG,First Trust Multi-Manager Large Growth ETF,Equity,83.63M
MARW,AllianzIM U.S. Equity Buffer20 Mar ETF,Alternatives,83.60M
KURE,KraneShares MSCI All China Health Care Index ETF,Equity,83.58M
NVD,GraniteShares 2x Short NVDA Daily ETF,Equity,83.35M
ASCI,Abrdn International Small Cap Active ETF,Equity,83.06M
SSK,REX-Osprey SOL + Staking ETF,Currency,83.03M
HIGH,Simplify Enhanced Income ETF,Fixed Income,83.02M
IBLC,iShares Blockchain and Tech ETF,Equity,82.97M
IFEB,Innovator International Developed Power Buffer ETF February,Alternatives,82.94M
FTWO,Strive Natural Resources and Security ETF,Equity,82.89M
PCLG,Polen Focus Growth ETF,Equity,82.84M
SRTY,ProShares UltraPro Short Russell2000,Equity,82.67M
RWEM,Rayliant Wilshire NxtGen Emerging Markets Equity ETF,Equity,82.48M
DMX,DoubleLine Multi-Sector Income ETF,Fixed Income,82.39M
KAUG,Innovator US Small Cap Power Buffer ETF - August,Alternatives,82.17M
BOAT,SonicShares Global Shipping ETF,Equity,82.01M
BKEM,BNY Mellon Emerging Markets Equity ETF,Equity,81.96M
FFTY,Innovator IBD 50 ETF,Equity,81.94M
VAMO,Cambria Value & Momentum ETF,Equity,81.70M
IBIK,iShares iBonds Oct 2034 Term TIPS ETF,Fixed Income,81.67M
KARS,KraneShares Electric Vehicles & Future Mobility Index ETF,Equity,81.59M
MMCA,NYLI MacKay California Muni Intermediate ETF,Fixed Income,81.57M
FLSW,Franklin FTSE Switzerland ETF,Equity,81.54M
FLCV,Federated Hermes MDT Large Cap Value ETF,Equity,81.41M
XBJL,Innovator U.S. Equity Accelerated 9 Buffer ETF - July,Alternatives,81.39M
HERO,Global X Video Games & Esports ETF,Equity,81.15M
INEQ,Columbia International Equity Income ETF,Equity,80.93M
RSDE,FT Vest U.S. Equity Equal Weight Buffer ETF - December,Alternatives,80.93M
BKSE,BNY Mellon US Small Cap Core Equity ETF,Equity,80.79M
GSJY,Goldman Sachs ActiveBeta Japan Equity ETF,Equity,80.69M
GMOV,GMO US Value ETF,Equity,80.66M
FEDM,FlexShares ESG & Climate Developed Markets ex-US Core Index Fund,Equity,80.58M
DVAL,BrandywineGLOBAL - Dynamic US Large Cap Value ETF,Equity,80.54M
HGRO,Hedgeye Quality Growth ETF,Equity,80.54M
VEGA,AdvisorShares STAR Global Buy-Write ETF,Asset Allocation,80.42M
IBIC,iShares iBonds Oct 2026 Term TIPS ETF,Fixed Income,80.27M
AIMS,Acuitas Small Cap Active ETF,Equity,79.94M
LODI,AAM SLC Low Duration Income ETF,Fixed Income,79.93M
PUI,Invesco Dorsey Wright Utilities Momentum ETF,Equity,79.78M
HDGE,AdvisorShares Ranger Equity Bear ETF,Equity,79.52M
PUSH,PGIM Ultra Short Municipal Bond ETF,Fixed Income,79.42M
BIB,ProShares Ultra Nasdaq Biotechnology,Equity,79.13M
LDRT,iShares iBonds 1-5 Year Treasury Ladder ETF,Fixed Income,79.12M
NAUG,Innovator Growth-100 Power Buffer ETF - August,Alternatives,79.07M
NUMI,Nuveen Municipal Income ETF,Fixed Income,79.03M
TOAK,Twin Oak Short Horizon Absolute Return ETF,Alternatives,79.02M
DHLX,Diamond Hill Large Cap Concentrated ETF,Equity,78.94M
HECO,State Street Galaxy Hedged Digital Asset Ecosystem ETF,Equity,78.91M
MKTN,Federated Hermes MDT Market Neutral ETF,Alternatives,78.85M
JANZ,TrueShares Structured Outcome (January) ETF,Alternatives,78.82M
IONL,GraniteShares 2x Long IONQ Daily ETF,Equity,78.69M
VABS,Virtus Newfleet Securitized Income ETF,Fixed Income,78.68M
HYTI,FT Vest High Yield & Target Income ETF,Alternatives,78.54M
QGRD,Horizon Nasdaq-100 Defined Risk ETF,Equity,78.54M
JULT,AllianzIM U.S. Equity Buffer10 Jul ETF,Alternatives,78.44M
PRAY,FIS Christian Stock Fund,Equity,78.31M
RBIL,F/m Ultrashort Treasury Inflation-Protected Security (TIPS) ETF,Fixed Income,78.14M
DUST,Direxion Daily Gold Miners Index Bear 2X ETF,Equity,78.01M
RFDA,ALPS Dynamic US Dividend Advantage ETF,Equity,77.79M
ETHD,ProShares UltraShort Ether ETF,Currency,77.73M
DHDG,FT Vest U.S. Equity Quarterly 2.5 to 15 Buffer ETF,Alternatives,77.67M
QXQ,SGI Enhanced Nasdaq 100 ETF,Equity,77.65M
RDFI,Rareview Dynamic Fixed Income ETF,Fixed Income,77.51M
STXK,Strive Small-Cap ETF,Equity,77.41M
FXC,Invesco CurrencyShares Canadian Dollar Trust,Currency,77.29M
UJUN,Innovator U.S. Equity Ultra Buffer ETF - June,Alternatives,77.18M
SURI,Simplify Propel Opportunities ETF,Asset Allocation,77.14M
QABA,First Trust NASDAQ ABA Community Bank Index Fund,Equity,77.01M
GRW,TCW Durable Growth ETF,Equity,76.76M
CNBS,Amplify Seymour Cannabis ETF,Equity,76.72M
HYDR,Global X Hydrogen ETF,Equity,76.59M
GLNK,Grayscale Chainlink Trust ETF,Currency,76.50M
PBL,PGIM Portfolio Ballast ETF,Asset Allocation,76.41M
STXV,Strive 1000 Value ETF,Equity,76.40M
TUGN,STF Tactical Growth & Income ETF,Asset Allocation,76.39M
NIKL,Sprott Nickel Miners ETF,Equity,76.37M
SAGP,Strategas Global Policy Opportunities ETF,Equity,76.37M
MIDU,Direxion Daily Mid Cap Bull 3X ETF,Equity,76.35M
PXI,Invesco Dorsey Wright Energy Momentum ETF,Equity,76.30M
PRXG,Praxis Impact Large Cap Growth ETF,Equity,76.24M
RXL,ProShares Ultra Health Care,Equity,76.23M
XSHD,Invesco S&P SmallCap High Dividend Low Volatility ETF,Equity,76.04M
RSBY,Return Stacked Bonds & Futures Yield ETF,Asset Allocation,75.94M
WCBR,WisdomTree Cybersecurity Fund,Equity,75.91M
USOY,Defiance Oil Enhanced Options Income ETF,Commodity,75.90M
SEMY,GraniteShares YieldBOOST Semiconductor ETF,Equity,75.79M
EETH,ProShares Ether ETF,Currency,75.52M
TRSY,Xtrackers US 0-1 Year Treasury ETF,Fixed Income,75.36M
TSMY,YieldMax TSM Option Income Strategy ETF,Equity,75.36M
HIBL,Direxion Daily S&P 500 High Beta Bull 3X ETF,Equity,75.28M
ITAN,Sparkline Intangible Value ETF,Equity,75.23M
SPXE,ProShares S&P 500 Ex-Energy ETF,Equity,75.20M
AGGA,EA Astoria Dynamic Core US Fixed Income ETF,Fixed Income,75.12M
YETH,Roundhill Ether Covered Call Strategy ETF,Currency,75.08M
XOCT,FT Vest U.S. Equity Enhance & Moderate Buffer ETF - October,Alternatives,75.06M
VCOB,Voya Core Bond ETF,Fixed Income,74.88M
PGRO,Putnam Focused Large Cap Growth ETF,Equity,74.87M
TSLS,Direxion Daily TSLA Bear 1X ETF,Equity,74.86M
RFLR,Innovator U.S. Small Cap Managed Floor ETF,Alternatives,74.65M
WLTG,WealthTrust DBS Long Term Growth ETF,Asset Allocation,74.42M
OAKI,Oakmark International Large Cap ETF,Equity,74.29M
QTPI,North Square RCIM Tax-Advantaged Preferred and Income Securities ETF,Fixed Income,74.29M
OASC,OneAscent Enhanced Small and Mid Cap ETF,Equity,73.95M
RFEM,First Trust Riverfront Dynamic Emerging Markets ETF,Equity,73.74M
QARP,Xtrackers Russell 1000 US Quality at a Reasonable Price ETF,Equity,73.71M
BCLO,iShares BBB-B CLO Active ETF,Fixed Income,73.53M
QCOC,FT Vest Nasdaq-100 Conservative Buffer ETF - October,Alternatives,73.48M
PQUS,Pictet AI Enhanced US Equity ETF,Equity,73.44M
FCEF,First Trust Income Opportunities ETF,Asset Allocation,73.35M
JDVI,John Hancock Disciplined Value International Select ETF,Equity,73.35M
JHHY,John Hancock High Yield ETF,Fixed Income,73.32M
JPY,Lazard Japanese Equity ETF,Equity,73.25M
NUAG,Nuveen Enhanced Yield U.S. Aggregate Bond ETF,Fixed Income,73.09M
ENZL,iShares MSCI New Zealand ETF,Equity,73.00M
DVOL,First Trust Dorsey Wright Momentum & Low Volatility ETF,Equity,72.85M
EPRF,Innovator S&P Investment Grade Preferred ETF,Fixed Income,72.66M
IMAR,Innovator International Developed Power Buffer ETF March,Alternatives,72.54M
GIGL,Goldman Sachs Corporate Bond ETF,Fixed Income,72.29M
RGTX,Defiance Daily Target 2X Long RGTI ETF,Equity,71.79M
HUSV,First Trust Horizon Managed Volatility Domestic ETF,Equity,71.75M
CANE,Teucrium Sugar Fund,Commodity,71.46M
KWT,iShares MSCI Kuwait ETF,Equity,71.16M
EUDG,WisdomTree Europe Quality Dividend Growth Fund,Equity,71.12M
XJUL,FT Vest U.S. Equity Enhance & Moderate Buffer ETF - July,Alternatives,70.82M
AOCT,Innovator 2 Yr to October 2026,Alternatives,70.70M
LEAD,Siren DIVCON Leaders Dividend ETF,Equity,70.69M
SPBW,AllianzIM Buffer20 Allocation ETF,Alternatives,70.67M
PATN,Pacer Nasdaq International Patent Leaders ETF,Equity,70.62M
MAGG,Madison Aggregate Bond ETF,Fixed Income,70.54M
LNGX,Global X U.S. Natural Gas ETF,Equity,70.30M
DVYA,iShares Asia/Pacific Dividend ETF,Equity,70.28M
BAMU,Brookstone Ultra-Short Bond ETF,Fixed Income,70.24M
MMKT,Texas Capital Government Money Market ETF,Fixed Income,70.17M
LQDI,iShares Inflation Hedged Corporate Bond ETF,Fixed Income,70.07M
CGGG,Capital Group U.S. Large Growth ETF,Equity,70.05M
ITDE,iShares LifePath Target Date 2045 ETF USD,Asset Allocation,70.05M
CATF,American Century California Municipal Bond ETF,Fixed Income,69.97M
UBT,ProShares Ultra 20+ Year Treasury,Fixed Income,69.96M
ACII,Innovator Index Autocallable Income Strategy ETF,Alternatives,69.95M
FLCE,Frontier Asset US Large Cap Equity ETF,Equity,69.84M
LCR,Leuthold Core ETF,Asset Allocation,69.82M
SPXN,ProShares S&P 500 Ex-Financials ETF,Equity,69.82M
QUIZ,Zacks Quality International ETF,Equity,69.68M
DBEZ,Xtrackers MSCI Eurozone Hedged Equity ETF,Equity,69.64M
UPAR,UPAR Ultra Risk Parity ETF,Alternatives,69.56M
INKM,State Street Income Allocation ETF,Asset Allocation,69.55M
XRPT,Volatility Shares Trust XRP 2X ETF,Currency,69.10M
EIRL,iShares MSCI Ireland ETF,Equity,69.09M
XDSQ,Innovator US Equity Accelerated ETF,Alternatives,69.08M
FINT,Frontier Asset Total International Equity ETF,Equity,69.04M
EGGQ,NestYield Visionary ETF,Equity,69.02M
DEED,First Trust Securitized Plus ETF,Fixed Income,68.84M
FTOH,Franklin Ohio Municipal Income ETF,Fixed Income,68.65M
OCTU,AllianzIM U.S. Equity Buffer15 Uncapped Oct ETF,Alternatives,68.63M
PRXV,Praxis Impact Large Cap Value ETF,Equity,68.57M
FTCE,First Trust New Constructs Core Earnings Leaders ETF,Equity,68.35M
PQDI,Principal Spectrum Preferred and Income ETF,Fixed Income,68.29M
HOOG,Leverage Shares 2X Long HOOD Daily ETF,Equity,68.23M
AUGZ,TrueShares Structured Outcome (August) ETF,Alternatives,68.22M
IBBQ,Invesco Nasdaq Biotechnology ETF,Equity,68.17M
QCJL,FT Vest Nasdaq-100 Conservative Buffer ETF - July,Alternatives,68.11M
CNXT,VanEck ChiNext ETF,Equity,68.06M
GPTY,YieldMax AI & Tech Portfolio Option Income ETF,Equity,68.06M
GAA,Cambria Global Asset Allocation ETF,Asset Allocation,68.03M
EXUS,Nomura ETF Trust Nomura Focused International Core ETF,Equity,67.86M
JPMB,JPMorgan USD Emerging Markets Sovereign Bond ETF,Fixed Income,67.77M
TYA,Simplify Intermediate Term Treasury Futures Strategy ETF,Alternatives,67.61M
GTR,WisdomTree Target Range Fund,Equity,67.58M
RIGS,RiverFront Strategic Income Fund,Fixed Income,67.41M
ICPY,"Tweedy, Browne International Insider + Value ETF",Equity,67.34M
ILS,Brookmont Catastrophic Bond ETF,Fixed Income,67.25M
QMMY,FT Vest Nasdaq-100 Moderate Buffer ETF - May,Alternatives,67.07M
WLDR,Affinity World Leaders Equity ETF,Equity,66.85M
MTGP,WisdomTree Mortgage Plus Bond Fund,Fixed Income,66.67M
DDIV,First Trust Dorsey Wright Momentum & Dividend ETF,Equity,66.66M
EASG,Xtrackers MSCI EAFE Selection Equity ETF,Equity,66.37M
NBFC,Neuberger Flexible Credit Income ETF,Fixed Income,66.11M
JMMF,JPMorgan 100% U.S. Treasury Securities Money Market ETF,Fixed Income,66.08M
SXQG,ETC 6 Meridian Quality Growth ETF,Equity,66.01M
ITDF,iShares LifePath Target Date 2050 ETF USD,Asset Allocation,65.93M
PBTP,Invesco 0-5 Yr US TIPS ETF,Fixed Income,65.90M
MVPA,Miller Value Partners Appreciation ETF,Equity,65.81M
DTEC,ALPS Disruptive Technologies ETF,Equity,65.74M
RSPC,Invesco S&P 500 Equal Weight Communication Services ETF,Equity,65.68M
HYDW,Xtrackers Low Beta High Yield Bond ETF,Fixed Income,65.53M
JANT,AllianzIM U.S. Equity Buffer10 Jan ETF,Alternatives,65.50M
RDTL,GraniteShares 2x Long RDDT Daily ETF,Equity,65.44M
SARK,Tradr 1X Short Innovation Daily ETF,Equity,65.44M
JUNM,FT Vest U.S. Equity Max Buffer ETF - June,Alternatives,65.10M
RSEE,Rareview Systematic Equity ETF,Equity,65.10M
FCSH,Federated Hermes Short Duration Corporate ETF,Fixed Income,64.89M
BTGD,STKd 100% Bitcoin & 100% Gold ETF,Asset Allocation,64.85M
IBOT,Vaneck Robotics ETF,Equity,64.82M
RJDI,RJ Eagle GCM Dividend Select Income ETF,Equity,64.66M
ONLN,ProShares Online Retail ETF,Equity,64.62M
NACP,Tidal Trust III NAACP MINORITY EMPOWERMENT ETF,Equity,64.38M
KGRN,KraneShares MSCI China Clean Technology Index ETF,Equity,64.29M
WEEI,Westwood Salient Enhanced Energy Income ETF,Equity,64.11M
MAGX,Roundhill Daily 2X Long Magnificent Seven ETF,Equity,64.02M
STXD,Strive 1000 Dividend Growth ETF,Equity,63.78M
FXB,Invesco CurrencyShares British Pound Sterling Trust,Currency,63.65M
DOGG,FT Vest DJIA Dogs 10 Target Income ETF,Alternatives,63.64M
OCTZ,TrueShares Structured Outcome (October) ETF,Alternatives,63.60M
ARP,PMV Adaptive Risk Parity ETF,Alternatives,63.52M
FMCE,FM Compounders Equity ETF,Equity,63.50M
NODE,VanEck Onchain Economy ETF,Equity,63.39M
WDTE,Defiance S&P 500 Weekly Distribution ETF,Equity,63.33M
TMFS,Motley Fool Small-Cap Growth ETF,Equity,63.31M
ITDB,iShares LifePath Target Date 2030 ETF,Asset Allocation,63.26M
AIVI,WisdomTree International AI Enhanced Value Fund,Equity,62.99M
AVMA,Avantis Moderate Allocation ETF,Asset Allocation,62.92M
XBOC,Innovator U.S. Equity Accelerated 9 Buffer ETF - October,Alternatives,62.78M
CAMX,Cambiar Aggressive Value ETF,Equity,62.61M
XYLG,Global X S&P 500 Covered Call & Growth ETF,Equity,62.59M
VIXM,ProShares VIX Mid-Term Futures ETF,Alternatives,62.36M
XQQI,NEOS Boosted Nasdaq-100 High Income ETF,Equity,62.28M
EURL,Direxion Daily FTSE Europe Bull 3X ETF,Equity,62.23M
BAMB,Brookstone Intermediate Bond ETF,Fixed Income,62.18M
PHDG,Invesco S&P 500 Downside Hedged ETF,Equity,62.13M
NDOW,Anydrus Advantage ETF,Asset Allocation,62.11M
PAMC,Pacer Lunt MidCap Multi-Factor Alternator ETF,Equity,62.11M
IFLR,Innovator International Developed Managed Floor ETF,Alternatives,61.99M
QMAG,FT Vest Nasdaq-100 Moderate Buffer ETF - August,Alternatives,61.99M
NVYY,GraniteShares YieldBOOST NVDA ETF,Equity,61.92M
SOYB,Teucrium Soybean Fund,Commodity,61.90M
EFAD,ProShares MSCI EAFE Dividend Growers ETF,Equity,61.78M
FCUS,Pinnacle Focused Opportunities ETF,Equity,61.74M
QBER,TrueShares Quarterly Bear Hedge ETF,Equity,61.71M
LITP,Sprott Lithium Miners ETF,Equity,61.60M
LSAT,Leadershares Alphafactor Tactical Focused ETF,Equity,61.51M
RTRE,Rareview Total Return Bond ETF,Fixed Income,61.23M
XUDV,Franklin U.S. Dividend Booster Index ETF,Equity,61.22M
QMNV,FT Vest Nasdaq-100 Moderate Buffer ETF - November,Alternatives,61.12M
SYZ,Lazard US Systematic Small Cap Equity ETF,Equity,60.94M
MMSD,NYLI MacKay Muni Short Duration ETF,Fixed Income,60.91M
DIVL,Madison Dividend Value ETF,Equity,60.63M
EHLS,Even Herd Long Short ETF,Alternatives,60.47M
PSCW,Pacer Swan SOS Conservative (April) ETF,Alternatives,60.37M
FMED,Fidelity Disruptive Medicine ETF,Equity,60.35M
AHYB,American Century Select High Yield ETF,Fixed Income,60.28M
SMOM,Symmetry Panoramic Sector Momentum ETF,Equity,60.27M
GXPC,Global X PureCap MSCI Communication Services ETF,Equity,60.25M
MDPL,Monarch Dividend Plus ETF,Equity,60.05M
GXPT,Global X PureCap MSCI Information Technology ETF,Equity,59.89M
INDL,Direxion Daily MSCI India Bull 2X ETF,Equity,59.82M
EMOP,AB Emerging Markets Opportunities ETF,Equity,59.78M
PRMR,PeakShares RMR Prime Equity ETF,Equity,59.71M
JUNW,AllianzIM U.S. Equity Buffer20 Jun ETF,Alternatives,59.65M
YBIT,YieldMax Bitcoin Option Income Strategy ETF,Equity,59.58M
AMZZ,GraniteShares 2x Long AMZN Daily ETF,Equity,59.49M
ASCE,Allspring SMID Core ETF,Equity,59.43M
MARO,YieldMax MARA Option Income Strategy ETF,Equity,59.10M
OVT,Overlay Shares Short Term Bond ETF,Fixed Income,59.07M
MRAL,GraniteShares 2x Long MARA Daily ETF,Equity,58.96M
USL,United States 12 Month Oil Fund LP,Commodity,58.91M
TWM,ProShares UltraShort Russell2000,Equity,58.71M
DECZ,TrueShares Structured Outcome (December) ETF,Alternatives,58.59M
SOFX,Defiance Daily Target 2X Long SOFI ETF,Equity,58.57M
WCAP,WarCap Unconstrained Equity ETF,Equity,58.56M
QSIG,WisdomTree U.S. Short Term Corporate Bond Fund,Fixed Income,58.50M
AJUL,Innovator 2 Yr to July 2026,Alternatives,58.49M
FGSM,Frontier Asset Global Small Cap Equity ETF,Equity,58.37M
PBQQ,PGIM Laddered Nasdaq-100 Buffer 12 ETF,Alternatives,58.13M
EMC,Global X Emerging Markets Great Consumer ETF,Equity,58.12M
WOMN,Impact Shares Womens Empowerment ETF,Equity,58.08M
OCTT,AllianzIM U.S. Equity Buffer10 Oct ETF,Alternatives,57.99M
PSFD,Pacer Swan SOS Flex (January) ETF,Alternatives,57.95M
MAYU,AllianzIM U.S. Equity Buffer15 Uncapped May ETF,Alternatives,57.90M
SMOX,Horizon Small/Mid Cap Core Equity ETF,Equity,57.83M
FSCS,First Trust SMID Capital Strength ETF,Equity,57.77M
DEMZ,Democratic Large Cap Core ETF,Equity,57.75M
THLV,THOR Equal Weight Low Volatility ETF,Equity,57.74M
BSTP,Innovator Buffer Step-Up Strategy ETF,Alternatives,57.73M
TAXT,Northern Trust Tax-Exempt Bond ETF,Fixed Income,57.71M
NJUN,Innovator Growth-100 Power Buffer ETF - June,Alternatives,57.61M
KNGZ,First Trust S&P 500 Diversified Dividend Aristocrats ETF,Equity,57.55M
SEMG,Suncoast Select Growth ETF,Equity,57.47M
DEEF,Xtrackers FTSE Developed ex US Multifactor ETF,Equity,57.27M
WBIY,WBI Power Factor High Dividend ETF,Equity,57.22M
NCPB,Nuveen Core Plus Bond ETF,Fixed Income,57.15M
AGQI,First Trust Active Global Quality Income ETF,Equity,56.85M
YGLD,Simplify Gold Strategy PLUS Income ETF,Commodity,56.79M
UMAY,Innovator U.S. Equity Ultra Buffer ETF - May,Alternatives,56.77M
LCO,LOGIQ Contrarian Opportunities ETF,Asset Allocation,56.75M
KOOL,North Shore Equity Rotation ETF,Equity,56.64M
XIDV,Franklin International Dividend Booster Index ETF,Equity,56.48M
IWFG,NYLI Winslow Focused Large Cap Growth ETF,Equity,56.44M
GURU,Global X Guru Index ETF,Equity,56.42M
ABI,VictoryShares Pioneer Asset-Based Income ETF,Fixed Income,56.39M
LCF,Touchstone US Large Cap Focused ETF,Equity,56.28M
PBJA,PGIM S&P 500 Buffer 20 ETF - January,Alternatives,56.27M
DYFI,IDX Dynamic Fixed Income ETF,Fixed Income,56.23M
URE,ProShares Ultra Real Estate,Equity,56.20M
BNDS,Infrastructure Capital Bond Income ETF,Fixed Income,56.18M
EMM,Global X Emerging Markets ex-China ETF,Equity,56.13M
PSTR,Peakshares Sector Rotation ETF,Equity,56.13M
RFIX,Simplify Bond Bull ETF,Alternatives,56.07M
NDIA,Global X India Active ETF,Equity,56.06M
WSGE,Warren Street Global Equity ETF,Equity,55.90M
TBLU,Tortoise Global Water ETF,Equity,55.82M
INOV,Innovator International Developed Power Buffer ETF November,Alternatives,55.63M
HTAX,Nomura National High-Yield Municipal Bond ETF,Fixed Income,55.61M
XITK,State Street SPDR FactSet Innovative Technology ETF,Equity,55.41M
KTEC,KraneShares Hang Seng TECH Index ETF,Equity,55.36M
MSTI,Madison Short Term Strategic Income ETF,Fixed Income,55.28M
QVOY,Q3 All-Season Active Rotation ETF,Asset Allocation,55.25M
PRNT,3D Printing ETF,Equity,55.15M
MNBD,ALPS BBH Intermediate Municipal Bond ETF,Fixed Income,55.08M
HYIN,WisdomTree Private Credit and Alternative Income Fund,Asset Allocation,55.07M
IGTR,Innovator Gradient Tactical Rotation Strategy ETF,Equity,55.06M
URAA,Direxion Daily Uranium Industry Bull 2X ETF,Equity,55.03M
TRND,Pacer Trendpilot Fund of Funds ETF,Equity,54.95M
GABF,Gabelli Financial Services Opportunities ETF,Equity,54.88M
BBP,Virtus Biotech ETF,Equity,54.87M
RUSC,Russell Investments U.S. Small Cap Equity ETF,Equity,54.73M
OARK,YieldMax Innovation Option Income Strategy ETF,Equity,54.53M
SPCT,Liberty One Spectrum ETF,Equity,54.50M
ADIV,Guinness Atkinson Asia Pacific Dividend Builder ETF,Equity,54.35M
NBTR,Neuberger Total Return Bond ETF,Fixed Income,54.11M
AMAX,Adaptive Hedged Multi-Asset Income ETF,Asset Allocation,54.08M
HTEC,ROBO Global Healthcare Technology and Innovation ETF,Equity,54.07M
IBHK,iShares iBonds 2031 Term High Yield and Income ETF,Fixed Income,54.00M
OBND,State Street Loomis Sayles Opportunistic Bond ETF,Fixed Income,53.99M
ACKY,VistaShares Target 15 ACKtivist Distribution ETF,Equity,53.97M
FFIU,UVA Unconstrained Medium-Term Fixed Income ETF,Fixed Income,53.94M
EMCR,Xtrackers Emerging Markets Carbon Reduction and Climate Improvers ETF,Equity,53.73M
BRLN,iShares Floating Rate Loan Active ETF,Fixed Income,53.69M
QLVD,FlexShares Developed Markets ex-US Quality Low Volatility Index Fund,Equity,53.65M
DXD,ProShares UltraShort Dow30,Equity,53.64M
DYNB,Hartford Dynamic Bond ETF,Fixed Income,53.52M
CBLS,Clough Hedged Equity ETF,Equity,53.51M
XDQQ,Innovator Growth Accelerated ETF - Quarterly,Alternatives,53.46M
OZEM,Roundhill GLP-1 & Weight Loss ETF,Equity,53.30M
MADE,iShares U.S. Manufacturing ETF,Equity,53.27M
AMUN,Abrdn Ultra Short Muncipal Income Active ETF,Fixed Income,53.18M
CPSM,Calamos S&P 500 Structured Alt Protection ETF,Alternatives,52.95M
LALT,First Trust Multi-Strategy Alternative ETF,Alternatives,52.74M
AVNV,Avantis All International Markets Value ETF,Equity,52.63M
BGLD,FT Vest Gold Strategy Quarterly Buffer ETF,Alternatives,52.63M
LLYX,Defiance Daily Target 2X Long LLY ETF,Equity,52.47M
IRTR,iShares LifePath Retirement ETF,Asset Allocation,52.29M
MSOX,AdvisorShares MSOS Daily Leveraged ETF,Equity,52.27M
RPHS,Regents Park Hedged Market Strategy ETF,Equity,52.23M
LQDB,iShares BBB Rated Corporate Bond ETF,Fixed Income,52.15M
HRTS,Tema Heart & Health ETF,Equity,52.14M
NTSE,WisdomTree Emerging Markets Efficient Core Fund,Asset Allocation,52.12M
CLOC,AAM Crescent CLO ETF,Fixed Income,52.08M
ROSC,Hartford Multifactor Small Cap ETF,Equity,52.06M
MEM,Matthews Emerging Markets Equity Active ETF,Equity,51.95M
AAPR,Innovator 2 Yr to April 2028,Alternatives,51.91M
SPBX,AllianzIM 6 Month Buffer10 Allocation ETF,Alternatives,51.86M
BAMA,Brookstone Active ETF,Asset Allocation,51.84M
ARLU,AllianzIM U.S. Equity Buffer15 Uncapped Apr ETF,Alternatives,51.44M
NULC,Nuveen ESG Large-Cap ETF,Equity,51.41M
EVYM,Eaton Vance High Income Municipal ETF,Fixed Income,51.24M
ARCM,Arrow Reserve Capital Management ETF,Fixed Income,51.12M
ADFI,Anfield Dynamic Fixed Income ETF,Fixed Income,51.08M
XXV,Simplify Ancorato Target 25 Distribution ETF,Asset Allocation,51.05M
SURE,AdvisorShares Insider Advantage ETF,Equity,50.95M
RSPE,Invesco ESG S&P 500 Equal Weight ETF,Equity,50.94M
FCTR,First Trust Lunt U.S. Factor Rotation ETF,Equity,50.90M
CHPS,Xtrackers Semiconductor Select Equity ETF,Equity,50.89M
XIJN,FT Vest U.S. Equity Buffer & Premium Income ETF - June,Alternatives,50.89M
XRLX,FundX Investment Conservative ETF,Asset Allocation,50.63M
XAUG,FT Vest U.S. Equity Enhance & Moderate Buffer ETF - August,Alternatives,50.60M
GNOM,Global X Genomics & Biotechnology ETF,Equity,50.47M
REIT,ALPS Active REIT ETF,Equity,50.34M
BETZ,Roundhill Sports Betting & iGaming ETF,Equity,50.27M
GLOW,VictoryShares WestEnd Global Equity ETF,Equity,50.23M
EDGI,3EDGE Dynamic International Equity ETF,Equity,50.22M
TEMD,Templeton Emerging Markets Debt ETF,Fixed Income,50.22M
DIEM,Franklin Emerging Market Core Dividend Tilt Index ETF,Equity,50.21M
THMZ,Lazard Equity Megatrends ETF,Equity,50.11M
IHY,VanEck International High Yield Bond ETF,Fixed Income,50.06M
MYCF,State Street My2026 Corporate Bond ETF,Fixed Income,50.04M
TAFL,AB Tax-Aware Long Municipal ETF,Fixed Income,50.01M
SRHR,SRH REIT Covered Call ETF,Equity,49.94M
BLDG,Cambria Global Real Estate ETF,Equity,49.83M
FHYS,Federated Hermes Short Duration High Yield ETF,Fixed Income,49.80M
PSR,Invesco Active U.S. Real Estate Fund,Equity,49.75M
CPRY,Calamos Russell 2000 Structured Alt Protection ETF January,Alternatives,49.61M
TEKY,Lazard Next Gen Technologies ETF,Equity,49.60M
FLQS,Franklin U.S. Small Cap Multifactor Index ETF,Equity,49.59M
XFLX,FundX Flexible ETF,Asset Allocation,49.53M
TDSB,ETC Cabana Target Beta ETF,Asset Allocation,49.30M
HBR,Canary HBAR ETF,Currency,49.29M
DUSL,Direxion Daily Industrials Bull 3X ETF,Equity,49.16M
SDEM,Global X MSCI SuperDividend Emerging Markets ETF,Equity,49.07M
EASY,Liberty One Defensive Dividend Growth ETF,Equity,48.90M
CARZ,First Trust S-Network Future Vehicles & Technology ETF,Equity,48.87M
SIXP,AllianzIM U.S. Equity 6 Month Buffer10 Mar/Sep ETF,Alternatives,48.85M
HYRM,Xtrackers Risk Managed USD High Yield Strategy ETF,Fixed Income,48.83M
ABIG,Argent Large Cap ETF,Equity,48.82M
XRMI,Global X S&P 500 Risk Managed Income ETF,Alternatives,48.76M
INQQ,The India Internet ETF,Equity,48.43M
IBIJ,iShares iBonds Oct 2033 Term TIPS ETF,Fixed Income,48.37M
DRN,Direxion Daily Real Estate Bull 3X ETF,Equity,48.31M
TOLL,Tema Durable Quality ETF,Equity,48.26M
FKU,First Trust United Kingdom AlphaDEX Fund,Equity,48.25M
DSTX,Distillate International Fundamental Stability & Value ETF,Equity,48.23M
NXTE,AXS Green Alpha ETF,Equity,48.15M
AHLT,American Beacon AHL Trend ETF,Asset Allocation,48.13M
GXPS,Global X PureCap MSCI Consumer Staples ETF,Equity,48.07M
GGME,Invesco Next Gen Media and Gaming ETF,Equity,48.01M
APRT,AllianzIM U.S. Equity Buffer10 Apr ETF,Alternatives,47.75M
PRSD,State Street Short Duration IG Public & Private Credit ETF,Fixed Income,47.64M
SIXF,AllianzIM U.S. Equity 6 Month Buffer10 Feb/Aug ETF,Alternatives,47.49M
EUO,ProShares UltraShort Euro,Currency,47.48M
NETL,Colterpoint Net Lease Real Estate ETF,Equity,47.45M
GRNI,Fundstrat Granny Shots US Large Cap & Income ETF,Equity,47.41M
ASIA,Matthews Pacific Tiger Active ETF,Equity,47.34M
BCFN,Baron Financials ETF,Equity,47.34M
