ticker,name,asset_class,assets_aum
UPW,ProShares Ultra Utilities,Equity,25.14M
DEEP,Acquirers Small and Micro Deep Value ETF,Equity,25.13M
XTJL,Innovator U.S. Equity Accelerated Plus ETF - July,Alternatives,25.09M
BYRE,Principal Real Estate Active Opportunities ETF,Equity,25.08M
XLEI,State Street Energy Select Sector SPDR Premium Income ETF,Equity,25.03M
MARB,First Trust Merger Arbitrage ETF,Alternatives,25.01M
FAAA,Fidelity AAA CLO ETF,Fixed Income,25.00M
FCLO,Fidelity CLO ETF,Fixed Income,24.97M
JLQD,Janus Henderson Corporate Bond ETF,Fixed Income,24.97M
BTOT,iShares Total USD Fixed Income Market ETF,Fixed Income,24.96M
UJB,ProShares Ultra High Yield,Fixed Income,24.93M
XIDE,FT Vest U.S. Equity Buffer & Premium Income ETF - December,Alternatives,24.89M
QQQD,Direxion Daily Magnificent 7 Bear 1X ETF,Equity,24.87M
OCTP,PGIM S&P 500 Buffer 12 ETF - October,Alternatives,24.81M
JPSV,JPMorgan Active Small Cap Value ETF,Equity,24.74M
GLIX,Lazard Listed Infrastructure ETF,Equity,24.72M
ALIL,Argent Focused Small Cap ETF,Equity,24.71M
JULM,FT Vest U.S. Equity Max Buffer ETF - July,Alternatives,24.69M
RAYJ,Rayliant SMDAM Japan Equity ETF,Equity,24.62M
SAEF,Schwab Ariel Opportunities ETF,Equity,24.52M
RHRX,RH Tactical Rotation ETF,Equity,24.36M
TARK,AXS 2X Innovation ETF Fund,Equity,24.32M
HELS,Hedgeye 130/30 Equity ETF,Equity,24.30M
TILL,Teucrium Agricultural Strategy No K-1 ETF,Commodity,24.27M
BIGY,YieldMax Target 12 Big 50 Option Income ETF,Equity,24.19M
TAX,Cambria Tax Aware ETF,Equity,24.16M
JAPN,Horizon Kinetics Japan Owner Operator ETF,Equity,24.07M
SAA,ProShares Ultra SmallCap600,Equity,24.06M
PBSE,PGIM S&P 500 Buffer 20 ETF - September,Alternatives,24.03M
PSCF,Invesco S&P SmallCap Financials ETF,Equity,24.03M
PQJA,PGIM Nasdaq-100 Buffer 12 ETF - January,Alternatives,23.98M
WAR,U.S. Global Technology and Aerospace & Defense ETF,Equity,23.96M
NOVP,PGIM S&P 500 Buffer 12 ETF - November,Alternatives,23.94M
HIBS,Direxion Daily S&P 500 High Beta Bear 3X ETF,Equity,23.84M
FDRS,Founder-Led ETF,Equity,23.82M
APRH,Innovator Premium Income 20 Barrier ETF - April,Alternatives,23.77M
PPTY,US Diversified Real Estate ETF,Equity,23.68M
EMDM,First Trust Bloomberg Emerging Market Democracies ETF,Equity,23.58M
CANQ,Calamos Nasdaq Equity & Income ETF,Asset Allocation,23.55M
WBIF,WBI BullBear Value 3000 ETF,Equity,23.55M
AMZP,Kurv Yield Prem Strategy Amazon ETF,Equity,23.54M
XBCI,NEOS Boosted Bitcoin High Income ETF,Currency,23.51M
NRSH,Aztlan North America Nearshoring Stock Selection ETF,Equity,23.48M
YFFI,Indexperts Yield Focused Fixed Income ETF,Fixed Income,23.45M
TBJL,Innovator 20+ Year Treasury Bond 9 Buffer ETF - July,Alternatives,23.40M
BTCZ,T-Rex 2X Inverse Bitcoin Daily Target ETF,Currency,23.36M
RMNY,Rockefeller New York Municipal Bond ETF,Fixed Income,23.32M
SHUS,Stratified LargeCap Hedged ETF,Equity,23.31M
USSH,WisdomTree 1-3 Year Laddered Treasury Fund,Fixed Income,23.29M
CPRJ,Calamos Russell 2000 Structured Alt Protection ETF July,Alternatives,23.25M
PBJN,PGIM S&P 500 Buffer 20 ETF - June,Alternatives,23.25M
MST,Defiance Leveraged Long Income MSTR ETF,Equity,23.17M
XNOV,FT Vest U.S. Equity Enhance & Moderate Buffer ETF - November,Alternatives,23.17M
ITDI,iShares LifePath Target Date 2065 ETF,Asset Allocation,23.06M
GOOP,Kurv Yield Premium Strategy Google (GOOGL) ETF,Equity,22.97M
ICOI,Bitwise COIN Option Income Strategy ETF,Equity,22.96M
PEZ,Invesco Dorsey Wright Consumer Cyclicals Momentum ETF,Equity,22.94M
PBAU,PGIM S&P 500 Buffer 20 ETF - August,Alternatives,22.93M
MCH,Matthews China Active ETF,Equity,22.75M
BCDF,Horizon Kinetics Blockchain Development ETF,Equity,22.74M
FMQQ,FMQQ The Next Frontier Internet ETF,Equity,22.72M
FTKI,First Trust Small Cap BuyWrite Income ETF,Equity,22.67M
FUSI,American Century Multisector Floating Income ETF,Fixed Income,22.67M
HELX,Franklin Genomic Advancements ETF,Equity,22.61M
PSCD,Invesco S&P SmallCap Consumer Discretionary ETF,Equity,22.61M
TMNL,T. Rowe Price Long Municipal Income ETF,Fixed Income,22.59M
IVSS,Applied Finance IVS US SMID ETF,Equity,22.57M
RCTR,First Trust Bloomberg Nuclear Power ETF,Equity,22.37M
NVDQ,T-Rex 2X Inverse NVIDIA Daily Target ETF,Equity,22.34M
MUSQ,MUSQ Global Music Industry Index ETF,Equity,22.33M
FFDI,Fidelity Fundamental Developed International ETF,Equity,22.28M
RIOX,Defiance Daily Target 2X Long RIOT ETF,Equity,22.28M
GPT,Intelligent Alpha Atlas ETF,Equity,22.16M
PSFM,Pacer Swan SOS Flex (April) ETF,Alternatives,22.10M
SSFI,Day Hagan / Ned Davis Research Smart Sector Fixed Income ETF,Fixed Income,22.08M
AAVM,Alpha Architect Global Factor Equity ETF,Equity,22.06M
PCHI,Polen High Income ETF,Fixed Income,22.03M
FLJJ,AllianzIM U.S. Equity 6 Month Floor5 Jan/Jul ETF,Alternatives,22.00M
XTAP,Innovator U.S. Equity Accelerated Plus ETF,Alternatives,21.99M
NVDD,Direxion Daily NVDA Bear 1X ETF,Equity,21.95M
PSIL,AdvisorShares Psychedelics ETF,Equity,21.90M
MVPL,Miller Value Partners Leverage ETF,Equity,21.84M
QPUX,Defiance 2X Daily Long Pure Quantum ETF,Equity,21.82M
MJSC,MUFG Japan Small Cap Active ETF,Equity,21.76M
HFMF,Unlimited HFMF Managed Futures ETF,Alternatives,21.66M
SDTY,YieldMax S&P 500 0DTE Covered Call Strategy ETF,Equity,21.66M
SLTY,YieldMax Ultra Short Option Income Strategy ETF,Equity,21.63M
CAFG,Pacer US Small Cap Cash Cows Growth Leaders ETF,Equity,21.61M
LINT,Direxion Daily INTC Bull 2X ETF,Equity,21.52M
TGLB,T. Rowe Price Global Equity ETF,Equity,21.43M
VEMY,Virtus Stone Harbor Emerging Markets High Yield Bond ETF,Fixed Income,21.42M
LBAY,Leatherback Long/Short Alternative Yield ETF,Alternatives,21.39M
GDOC,Future Health Care Equity ETF,Equity,21.38M
RBLD,First Trust Alerian US NextGen Infrastructure ETF,Equity,21.38M
XBFR,Innovator Equity Managed 10 Buffer ETF,Alternatives,21.37M
MANI,Man Active Income ETF,Fixed Income,21.32M
KONG,Formidable Fortress ETF,Equity,21.30M
HDG,ProShares Hedge Replication ETF,Alternatives,21.28M
CA,Xtrackers California Municipal Bond ETF,Fixed Income,21.22M
FTXG,First Trust Nasdaq Food & Beverage ETF,Equity,21.20M
ILIT,iShares Lithium Miners and Producers ETF,Equity,21.15M
TSLP,Kurv Yield Prem Strategy Tesla ETF,Equity,21.15M
ULTI,REX IncomeMax Option Strategy ETF,Equity,21.12M
MEMS,Matthews Emerging Markets Discovery Active ETF,Equity,20.90M
PQAP,PGIM Nasdaq-100 Buffer 12 ETF - April,Alternatives,20.86M
QETH,Invesco Galaxy Ethereum ETF,Currency,20.81M
XTOC,Innovator U.S. Equity Accelerated Plus ETF - October,Alternatives,20.75M
CVRT,Calamos Convertible Equity Alternative ETF,Fixed Income,20.71M
TACN,T. Rowe Price Active Core International Equity ETF,Equity,20.71M
CRMG,Leverage Shares 2X Long CRM Daily ETF,Equity,20.48M
SLON,ProShares Ultra Solana ETF,Currency,20.46M
JULZ,TrueShares Structured Outcome (July) ETF,Alternatives,20.44M
FORH,Formidable ETF,Asset Allocation,20.42M
PSCM,Invesco S&P SmallCap Materials ETF,Equity,20.42M
NMBL,NovaTide Flexible Allocation ETF,Asset Allocation,20.38M
NOVZ,TrueShares Structured Outcome (November) ETF,Alternatives,20.36M
DRAI,Draco Evolution AI ETF,Asset Allocation,20.30M
TPLS,Thornburg Core Plus Bond ETF,Fixed Income,20.27M
DRKY,VistaShares Target 15 DRUKMacro Distribution ETF,Equity,20.26M
NVDS,Tradr 1.5X Short NVDA Daily ETF,Equity,20.24M
YLDW,Westwood Enhanced Income Opportunity ETF,Asset Allocation,20.22M
APRP,PGIM S&P 500 Buffer 12 ETF - April,Alternatives,20.21M
OWNB,Bitwise Bitcoin Standard Corporations ETF,Equity,20.14M
XOEF,iShares S&P 500 ex S&P 100 ETF,Equity,20.03M
JULP,PGIM S&P 500 Buffer 12 ETF - July,Alternatives,19.92M
BWTG,Brendan Wood TopGun ETF,Equity,19.91M
TSMG,Leverage Shares 2X Long TSM Daily ETF,Equity,19.85M
TMED,T. Rowe Price Health Care ETF,Equity,19.82M
OCTH,Innovator Premium Income 20 Barrier ETF - October,Alternatives,19.78M
OVS,Overlay Shares Small Cap Equity ETF,Equity,19.72M
QDTY,YieldMax Nasdaq 100 0DTE Covered Call Strategy ETF,Equity,19.72M
TTT,ProShares UltraPro Short 20+ Year Treasury,Fixed Income,19.69M
SEF,ProShares Short Financials,Equity,19.67M
MHY,Man Active High Yield ETF,Fixed Income,19.65M
PEMX,Putnam Emerging Markets ex-China ETF,Equity,19.62M
HF,DGA Core Plus Absolute Return ETF,Alternatives,19.61M
JUNT,AllianzIM U.S. Equity Buffer10 Jun ETF,Alternatives,19.61M
MRCP,PGIM S&P 500 Buffer 12 ETF - March,Alternatives,19.56M
SROI,Calamos Antetokounmpo Global Sustainable Equities ETF,Equity,19.45M
FBUF,Fidelity Dynamic Buffered Equity ETF,Alternatives,19.43M
FTBI,First Trust Balanced Income ETF,Asset Allocation,19.36M
WTIP,WisdomTree Inflation Plus Fund,Asset Allocation,19.24M
DFII,FT Vest Bitcoin Strategy & Target Income ETF,Alternatives,19.23M
SCAP,Infrastructure Capital Small Cap Income ETF,Equity,19.20M
OCTJ,Innovator Premium Income 30 Barrier ETF - October,Alternatives,19.17M
CPXR,USCF Daily Target 2X Copper Index ETF,Commodity,19.15M
AVGU,GraniteShares 2x Long AVGO Daily ETF,Equity,19.09M
JANH,Innovator Premium Income 20 Barrier ETF - January,Alternatives,19.08M
FEBP,PGIM S&P 500 Buffer 12 ETF - February,Alternatives,19.02M
SEA,U.S. Global Sea to Sky Cargo ETF,Equity,19.00M
CVNY,YieldMax CVNA Option Income Strategy ETF,Equity,18.97M
JHAI,Janus Henderson Global Artificial Intelligence ETF,Equity,18.90M
YSPY,GraniteShares YieldBOOST SPY ETF,Equity,18.86M
CBON,VanEck China Bond ETF,Fixed Income,18.83M
MFLX,First Trust Flexible Municipal High Income ETF,Fixed Income,18.82M
HAIL,State Street SPDR S&P Kensho Smart Mobility ETF,Equity,18.81M
MEME,Roundhill Meme Stock ETF,Equity,18.81M
SKF,ProShares UltraShort Financials,Equity,18.75M
PCLO,Virtus Seix AAA Private Credit CLO ETF,Fixed Income,18.72M
CPSP,Calamos S&P 500 Structured Alt Protection ETF - April,Alternatives,18.69M
SSG,Proshares Ultrashort Semiconductors,Equity,18.64M
BABO,YieldMax BABA Option Income Strategy ETF,Equity,18.61M
RINF,ProShares Inflation Expectations ETF,Alternatives,18.61M
DUG,ProShares UltraShort Energy,Equity,18.59M
HFEQ,Unlimited HFEQ Equity Long/Short ETF,Alternatives,18.57M
NEWZ,StockSnips AI-Powered Sentiment US All Cap ETF,Equity,18.52M
WANT,Direxion Daily Consumer Discretionary Bull 3X ETF,Equity,18.49M
SEPP,PGIM S&P 500 Buffer 12 ETF - September,Alternatives,18.48M
RTAI,Rareview Tax Advantaged Income ETF,Fixed Income,18.45M
MIG,VanEck Moody's Analytics IG Corporate Bond ETF,Fixed Income,18.30M
JMID,Janus Henderson Mid Cap Growth Alpha ETF,Equity,18.26M
TBX,ProShares Short 7-10 Year Treasury,Fixed Income,18.25M
UXOC,FT Vest U.S. Equity Uncapped Accelerator ETF - October,Alternatives,18.22M
ZTWO,F/M 2-Year Investment Grade Corporate Bond ETF,Fixed Income,18.22M
CRSH,YieldMax Short TSLA Option Income Strategy ETF,Equity,18.17M
RW,Rainwater Equity ETF,Equity,18.17M
USAF,Atlas America Fund,Asset Allocation,18.17M
SRS,ProShares UltraShort Real Estate,Equity,18.16M
JULH,Innovator Premium Income 20 Barrier ETF - July,Alternatives,18.05M
PBMY,PGIM S&P 500 Buffer 20 ETF - May,Alternatives,18.04M
CNQQ,Rayliant-ChinaAMC Transformative China Tech ETF,Equity,18.00M
EMPB,Efficient Market Portfolio Plus ETF Trust Units,Asset Allocation,18.00M
UBRL,GraniteShares 2x Long UBER Daily ETF,Equity,18.00M
MUNX,AMG GW&K Muni Income ETF,Fixed Income,17.99M
MEDX,Horizon Kinetics Medical ETF,Equity,17.98M
PQOC,PGIM Nasdaq-100 Buffer 12 ETF - October,Alternatives,17.97M
TESL,Simplify Volt TSLA Revolution ETF,Equity,17.94M
QIG,WisdomTree U.S. Corporate Bond Fund,Fixed Income,17.92M
VRAI,Virtus Real Asset Income ETF,Equity,17.90M
SCLZ,Swan Enhanced Dividend Income ETF,Equity,17.80M
MOTG,VanEck Morningstar Global Wide Moat ETF,Equity,17.79M
DLLL,GraniteShares 2x Long DELL Daily ETF,Equity,17.77M
RSJN,FT Vest U.S. Equity Equal Weight Buffer ETF - June,Alternatives,17.77M
SHRT,Gotham Short Strategies ETF,Equity,17.75M
QUSA,VistaShares Target 15 USA Quality Income ETF,Equity,17.72M
JHMU,John Hancock Dynamic Municipal Bond ETF,Fixed Income,17.65M
RGTZ,Defiance Daily Target 2x Short RGTI ETF,Equity,17.59M
SHRY,First Trust Bloomberg Shareholder Yield ETF,Equity,17.57M
XAPR,FT Vest U.S. Equity Enhance & Moderate Buffer ETF - April,Alternatives,17.55M
AUGP,PGIM S&P 500 Buffer 12 ETF - August,Alternatives,17.53M
IMST,Bitwise MSTR Option Income Strategy ETF,Equity,17.50M
MARZ,TrueShares Structured Outcome (March) ETF,Alternatives,17.29M
QSIX,Pacer Metaurus Nasdaq 100 Dividend Multiplier 600 ETF,Equity,17.25M
APRZ,TrueShares Structured Outcome (April) ETF,Alternatives,17.22M
HDMV,First Trust Horizon Managed Volatility Developed Intl ETF,Equity,17.21M
XHYD,BondBloxx USD High Yield Bond Consumer Non-Cyclicals Sector ETF,Fixed Income,17.21M
XBTY,GraniteShares YieldBOOST Bitcoin ETF,Currency,17.20M
RNEM,First Trust Emerging Markets Equity Select ETF,Equity,17.17M
AAPD,Direxion Daily AAPL Bear 1X ETF,Equity,17.15M
XHYT,"BondBloxx USD High Yield Bond Telecom, Media & Technology Sector ETF",Fixed Income,17.10M
ZMUN,F/m Ultrashort Tax-Free Municipal ETF,Fixed Income,17.05M
DIVD,Altrius Global Dividend ETF,Equity,16.98M
XMAY,FT Vest U.S. Equity Enhance & Moderate Buffer ETF - May,Alternatives,16.90M
BCHI,GMO Beyond China ETF,Equity,16.86M
FFLV,Fidelity Fundamental Large Cap Value ETF,Equity,16.84M
AAPB,GraniteShares 2x Long AAPL Daily ETF,Equity,16.83M
CDEI,"Calvert US Large-Cap Diversity, Equity and Inclusion Index ETF",Equity,16.74M
DTRE,First Trust Alerian Disruptive Technology Real Estate ETF,Equity,16.74M
VUS,Virtus US Dividend ETF,Equity,16.71M
QBUL,TrueShares Quarterly Bull Hedge ETF,Asset Allocation,16.69M
KJUN,Innovator U.S. Small Cap Power Buffer ETF - June,Alternatives,16.66M
QNXT,iShares Nasdaq-100 ex Top 30 ETF,Equity,16.62M
TNXT,T. Rowe Price Innovation Leaders ETF,Equity,16.62M
KPDD,KraneShares 2x Long PDD Daily ETF,Equity,16.61M
BTF,CoinShares Bitcoin and Ether ETF,Currency,16.48M
EZMO,AlphaDroid Broad Markets Momentum ETF,Asset Allocation,16.46M
WABF,Western Asset Bond ETF,Fixed Income,16.46M
BTCC,Grayscale Bitcoin Covered Call ETF,Currency,16.44M
TSEP,FT Vest Emerging Market Buffer ETF - September,Alternatives,16.41M
NBFR,Innovator Nasdaq-100 Managed 10 Buffer ETF,Alternatives,16.33M
WZRD,Opportunistic Trader ETF,Asset Allocation,16.33M
QTJA,Innovator Growth Accelerated Plus ETF - January,Alternatives,16.27M
XTJA,Innovator U.S. Equity Accelerated Plus ETF - January,Alternatives,16.27M
PJFM,PGIM Jennison Focused Mid-Cap ETF,Equity,16.25M
MYCK,State Street My2031 Corporate Bond ETF,Fixed Income,16.24M
AGMI,Themes Silver Miners ETF,Equity,16.23M
YQQQ,YieldMax Short N100 Option Income Strategy ETF,Equity,16.21M
JULJ,Innovator Premium Income 30 Barrier ETF - July,Alternatives,16.19M
ZTOP,F/m High Yield 100 ETF,Fixed Income,16.19M
QRMI,Global X NASDAQ 100 Risk Managed Income ETF,Equity,16.18M
UST,ProShares Ultra 7-10 Year Treasury,Fixed Income,16.15M
WTRE,WisdomTree New Economy Real Estate Fund,Equity,16.14M
ETU,T-Rex 2X Long Ether Daily Target ETF,Currency,16.07M
CLNK,Bitwise Chainlink ETF Beneficial Interest,Currency,16.04M
QTAP,Innovator Growth Accelerated Plus ETF - April,Alternatives,16.00M
TEXN,iShares Texas Equity ETF,Equity,15.88M
QRFT,QRAFT AI-Enhanced U.S. Large Cap ETF,Equity,15.81M
KHYB,KraneShares Asia Pacific High Income USD Bond ETF,Fixed Income,15.79M
MRGR,ProShares Merger ETF,Alternatives,15.78M
RMCA,Rockefeller California Municipal Bond ETF,Fixed Income,15.75M
RFCI,ALPS Dynamic Core Income ETF,Fixed Income,15.74M
VDI,Virtus International Dividend ETF,Equity,15.63M
HOOX,Defiance Daily Target 2X Long HOOD ETF,Equity,15.59M
PQJL,PGIM Nasdaq-100 Buffer 12 ETF - July,Alternatives,15.59M
MAYZ,TrueShares Structured Outcome (May) ETF,Alternatives,15.56M
ION,ProShares S&P Global Core Battery Metals ETF,Equity,15.53M
NERD,Roundhill Video Games ETF,Equity,15.52M
CEW,WisdomTree Emerging Currency Strategy Fund,Currency,15.50M
QLVE,FlexShares Emerging Markets Quality Low Volatility Index Fund,Equity,15.47M
GGLS,Direxion Daily GOOGL Bear 1X ETF,Equity,15.41M
JANJ,Innovator Premium Income 30 Barrier ETF - January,Alternatives,15.41M
EPV,ProShares UltraShort FTSE Europe,Equity,15.40M
BITC,Bitwise Trendwise Bitcoin and Treasuries Rotation Strategy ETF,Currency,15.31M
DECO,State Street Galaxy Digital Asset Ecosystem ETF,Equity,15.28M
NUGY,GraniteShares YieldBOOST Gold Miners ETF,Equity,15.27M
SETH,ProShares Short Ether ETF,Currency,15.25M
DGIN,VanEck Digital India ETF,Equity,15.24M
PSCU,Invesco S&P SmallCap Utilities & Communication Services ETF,Equity,15.21M
JCHI,JPMorgan Active China ETF Active China ETF,Equity,15.20M
MAYP,PGIM S&P 500 Buffer 12 ETF - May,Alternatives,15.18M
QTOC,Innovator Growth Accelerated Plus ETF - October,Alternatives,15.18M
MULT,Franklin Multisector Income ETF,Fixed Income,15.17M
LCDS,JPMorgan Fundamental Data Science Large Core ETF,Equity,15.13M
FMKT,Free Markets ETF,Equity,15.12M
XHYI,BondBloxx USD High Yield Bond Industrial Sector ETF,Fixed Income,15.10M
LSEQ,Harbor Long-Short Equity ETF,Alternatives,15.09M
BOUT,Innovator IBD Breakout Opportunities ETF,Equity,15.06M
MRVU,Direxion Daily MRVL Bull 2X ETF,Equity,15.06M
TPOR,Direxion Daily Transportation Bull 3X ETF,Equity,15.03M
FTAG,First Trust Indxx Global Agriculture ETF,Equity,14.89M
ESIM,Eventide International ETF,Equity,14.88M
LOPP,Gabelli Love Our Planet & People ETF,Equity,14.87M
AMZD,Direxion Daily AMZN Bear 1X ETF,Equity,14.85M
HCOW,Amplify COWS Covered Call ETF,Equity,14.82M
UNL,United States 12 Month Natural Gas Fund LP,Commodity,14.79M
PCLN,Pictet Cleaner Planet ETF,Equity,14.74M
VSOL,VanEck Solana ETF,Currency,14.74M
EEV,ProShares UltraShort MSCI Emerging Markets,Equity,14.69M
EMIF,iShares Emerging Markets Infrastructure ETF,Equity,14.65M
QQQS,Invesco NASDAQ Future Gen 200 ETF,Equity,14.55M
TSUI,21Shares Sui ETF,Currency,14.54M
ETFT,Fundsmith Equity ETF,Equity,14.52M
FPRO,Fidelity Real Estate Investment ETF,Equity,14.46M
GMOC,GMO Ultra-Short Income ETF,Fixed Income,14.40M
DVGR,DAC 3D Dividend Growth ETF,Equity,14.35M
CLCV,Crossmark Large Cap Value ETF,Equity,14.28M
QQQP,Tradr 2X Long Innovation 100 Quarterly ETF,Equity,14.27M
BMNZ,Defiance Daily Target 2X Short BMNR ETF,Equity,14.25M
OILT,Texas Capital Texas Oil Index ETF,Equity,14.19M
UUUG,Leverage Shares 2X Long UUUU Daily ETF,Equity,14.11M
LTTI,FT Vest 20+ Year Treasury & Target Income ETF,Alternatives,14.08M
BEG,Leverage Shares 2x Long BE Daily ETF,Equity,14.04M
ESLG,Eventide Large Cap Growth ETF,Equity,14.00M
JUNZ,TrueShares Structured Outcome (June) ETF,Alternatives,13.99M
FEBZ,TrueShares Structured Outcome (February) ETF,Alternatives,13.98M
PCRB,Putnam ESG Core Bond ETF,Fixed Income,13.98M
QQQA,ProShares Nasdaq-100 Dorsey Wright Momentum ETF,Equity,13.98M
NBGX,Neuberger Growth ETF,Equity,13.97M
WDGF,WisdomTree Global Defense Fund,Equity,13.90M
CPNM,Calamos Nasdaq-100 Structured Alt Protection ETF - March,Alternatives,13.88M
WMSB,Weitz Multisector Bond ETF,Fixed Income,13.85M
TSL,GraniteShares 1.25x Long Tesla Daily ETF,Equity,13.80M
SPTU,State Street SPDR Portfolio Ultra Short T-Bill ETF,Fixed Income,13.77M
SPUT,Innovator Daily PutWrite ETF,Equity,13.76M
LOCT,Innovator Premium Income 15 Buffer ETF - October,Alternatives,13.73M
SATG,Leverage Shares 2X Long SATS Daily ETF,Equity,13.62M
FDTS,First Trust Developed Markets ex-US Small Cap AlphaDEX Fund,Equity,13.61M
TOKE,Cambria Cannabis ETF,Equity,13.59M
EZJ,ProShares Ultra MSCI Japan,Equity,13.57M
MYMI,State Street My2029 Municipal Bond ETF,Fixed Income,13.56M
SMLL,Harbor Active Small Cap ETF,Equity,13.55M
EUM,ProShares Short MSCI Emerging Markets,Equity,13.39M
KPHO,KraneShares Dragon Capital Vietnam Growth Index ETF,Equity,13.37M
STRN,SMART Trend 25 ETF,Equity,13.36M
TACU,T. Rowe Price Active Core U.S. Equity ETF,Equity,13.32M
INDE,Matthews India Active ETF,Equity,13.31M
COPA,Themes Copper Miners ETF,Equity,13.30M
ONDG,Leverage Shares 2X Long ONDS Daily ETF,Equity,13.29M
BETH,ProShares Bitcoin & Ether Market Cap Weight ETF,Currency,13.22M
TFNS,T. Rowe Price Financials ETF,Equity,13.20M
UGE,ProShares Ultra Consumer Staples,Equity,13.15M
QOWZ,Invesco Nasdaq Free Cash Flow Achievers ETF,Equity,13.14M
XLVI,State Street Health Care Select Sector SPDR Premium Income ETF,Equity,13.13M
SZNE,Pacer CFRA-Stovall Equal Weight Seasonal Rotation ETF,Equity,13.12M
VNSE,Natixis Vaughan Nelson Select ETF,Equity,13.12M
RULE,Collaborative Investment Series Trust - Adaptive Core ETF,Asset Allocation,13.11M
CPSU,Calamos S&P 500 Structured Alt Protection Etf June,Alternatives,13.06M
DIVY,Sound Equity Dividend Income ETF,Equity,13.01M
EVLU,iShares MSCI Emerging Markets Value Factor ETF,Equity,12.90M
UPV,ProShares Ultra FTSE Europe,Equity,12.88M
SDCP,Virtus Newfleet Short Duration Core Plus Bond ETF,Fixed Income,12.86M
SPYQ,Tradr 2X Long SPY Quarterly ETF,Equity,12.85M
TSNF,Truth Social American Next Frontiers ETF,Equity,12.85M
AVGB,Avantis Credit ETF,Fixed Income,12.78M
PILL,Direxion Daily Pharmaceutical & Medical Bull 3X ETF,Equity,12.70M
ZVOL,Volatility Premium Plus ETF,Alternatives,12.68M
BFIX,Build Bond Innovation ETF,Fixed Income,12.67M
MKAM,MKAM ETF,Asset Allocation,12.64M
FARX,Frontier Asset Absolute Return ETF,Alternatives,12.61M
AAPX,T-Rex 2X Long Apple Daily Target ETF,Equity,12.57M
RJVI,RJ Eagle Vertical Income ETF,Asset Allocation,12.55M
QQHG,Invesco QQQ Hedged Advantage ETF,Equity,12.44M
DUKQ,Ocean Park Domestic ETF,Equity,12.39M
MYMJ,State Street My2030 Municipal Bond ETF,Fixed Income,12.39M
USFI,BrandywineGLOBAL - U.S. Fixed Income ETF,Fixed Income,12.33M
TYLG,Global X Information Technology Covered Call & Growth ETF,Equity,12.32M
EVNT,AltShares Event-Driven ETF,Alternatives,12.31M
LJAN,Innovator Premium Income 15 Buffer ETF - January,Alternatives,12.31M
REK,ProShares Short Real Estate,Equity,12.25M
EEMO,Invesco S&P Emerging Markets Momentum ETF,Equity,12.20M
ELIL,Direxion Daily LLY Bull 2X ETF,Equity,12.10M
SNPG,Xtrackers S&P 500 Growth Scored & Screened ETF,Equity,12.08M
ORCS,Direxion Daily ORCL Bear 1X ETF,Equity,12.06M
WEBS,Direxion Daily Dow Jones Internet Bear 3X ETF,Equity,12.01M
EBIT,Harbor AlphaEdge Small Cap Earners ETF,Equity,12.00M
FEAC,Fidelity Enhanced U.S. All-Cap Equity ETF,Equity,11.98M
SOUX,Defiance Daily Target 2X Long SOUN ETF,Equity,11.96M
TIME,Clockwise U.S. Core Equity ETF,Equity,11.90M
JHID,John Hancock International High Dividend ETF,Equity,11.83M
ITDJ,iShares LifePath Target Date 2070 ETF,Asset Allocation,11.70M
MEMA,Man Active Emerging Markets Alternative ETF,Alternatives,11.68M
BRAZ,Global X Brazil Active ETF,Equity,11.63M
SUPP,TCW Transform Supply Chain ETF,Equity,11.63M
ATCL,REX Autocallable Income ETF,Alternatives,11.61M
VAVX,Vaneck Avalanche ETF,Currency,11.61M
FEAT,YieldMax Dorsey Wright Featured 5 Income ETF,Equity,11.59M
UCC,ProShares Ultra Consumer Discretionary,Equity,11.58M
NVDB,ProShares Ultra NVDA,Equity,11.55M
PWER,Nomura Energy Transition ETF,Equity,11.52M
SPDG,State Street SPDR Portfolio S&P Sector Neutral Dividend ETF,Equity,11.51M
BALQ,iShares Nasdaq Premium Income Active ETF,Equity,11.49M
PEX,ProShares Global Listed Private Equity ETF,Equity,11.40M
CUSD,CrossingBridge Ultra-Short Duration ETF,Fixed Income,11.39M
KCAI,KraneShares China Alpha Index ETF,Equity,11.35M
JDOC,JPMorgan Healthcare Leaders ETF,Equity,11.34M
DUKH,Ocean Park High Income ETF,Fixed Income,11.33M
EQLT,iShares MSCI Emerging Markets Quality Factor ETF,Equity,11.25M
DIPS,YieldMax Short NVDA Option Income Strategy ETF,Equity,11.23M
PST,ProShares UltraShort 7-10 Year Treasury,Fixed Income,11.23M
MYMF,State Street My2026 Municipal Bond ETF,Fixed Income,11.22M
PQNT,Pictet AI Enhanced International Equity ETF,Equity,11.21M
MNRS,Grayscale Bitcoin Miners ETF,Equity,11.13M
PFIX,Simplify Interest Rate Hedge ETF,Alternatives,11.11M
GGTL,Gabelli Global Technology Leaders ETF,Equity,11.04M
INVN,Alger Russell Innovation ETF,Equity,11.03M
AMDD,Direxion Daily AMD Bear 1X ETF,Equity,11.02M
XPP,ProShares Ultra FTSE China 50,Equity,11.01M
HOYY,GraniteShares YieldBOOST HOOD ETF,Equity,10.97M
ABCS,Alpha Blue Capital US Small-Mid Cap Dynamic ETF,Equity,10.95M
QSU,Defiance Daily Target 2X Long QS ETF,Equity,10.94M
CONI,GraniteShares 2x Short COIN Daily ETF,Equity,10.92M
UTRE,US Treasury 3 Year Note ETF,Fixed Income,10.91M
PRAE,PlanRock Alternative Growth ETF,Asset Allocation,10.90M
MAPP,Harbor Multi-Asset Explorer ETF,Asset Allocation,10.85M
PBOT,Pictet AI & Automation ETF,Equity,10.81M
EMES,Harbor Emerging Markets Select ETF,Equity,10.78M
BAIG,Leverage Shares 2X Long BBAI Daily ETF,Equity,10.72M
PJBF,PGIM Jennison Better Future ETF,Equity,10.60M
XLUI,State Street Utilities Select Sector SPDR Premium Income ETF,Equity,10.56M
CPII,American Beacon Ionic Inflation Protection ETF,Fixed Income,10.55M
TSYX,TSPY Lift ETF,Equity,10.54M
ACGR,American Century Large Cap Growth ETF,Equity,10.47M
BMED,iShares Health Innovation Active ETF,Equity,10.45M
ERET,iShares Environmentally Aware Real Estate ETF,Equity,10.40M
VEM,Virtus Emerging Markets Dividend ETF,Equity,10.40M
CAS,Simplify China A Shares PLUS Income ETF,Equity,10.39M
RDOG,ALPS REIT Dividend Dogs ETF,Equity,10.39M
QSML,WisdomTree U.S. SmallCap Quality Growth Fund,Equity,10.38M
TDOT,21shares Polkadot ETF Shares of Beneficial Interest,Currency,10.34M
RDTY,YieldMax R2000 0DTE Covered Strategy ETF,Equity,10.27M
CPRA,Calamos Russell 2000 Structured Alt Protection ETF - April,Alternatives,10.25M
XHYF,BondBloxx USD High Yield Bond Financial & REIT Sector ETF,Fixed Income,10.25M
DEFI,Hashdex Commodities Trust,Currency,10.24M
DIVG,Invesco S&P 500 High Dividend Growers ETF,Equity,10.20M
BSJX,Invesco BulletShares 2033 High Yield Corporate Bond ETF,Fixed Income,10.16M
FUTG,Leverage Shares 2x Long FUTU Daily ETF,Equity,10.13M
TIPA,Northern Trust 2030 Inflation-Linked Distributing Ladder ETF,Fixed Income,10.11M
